{
  "$schema": "http://json-schema.org/draft-07/schema#",
  "title": "SceneCard",
  "type": "object",
  "required": ["chapter_number", "scene_number", "structural_phase", "pov_character", "mission", "conflict", "turning_point"],
  "properties": {
    "chapter_number": { "type": "integer" },
    "scene_number": { "type": "integer" },
    "structural_phase": {
      "type": "string",
      "enum": ["setup", "first_plot_point", "response", "first_pinch", "midpoint", "attack", "second_pinch", "second_plot_point", "resolution", "climax"]
    },
    "scene_type": {
      "type": "string",
      "enum": ["action", "sequel"],
      "description": "Bickham Scene & Sequel classification. Action scenes are disaster-driven (goal → conflict → disaster); sequel scenes are decision-driven (reaction → dilemma → decision). Optional — not every scene card needs this labelled, but workshop plan-level scene cards carry it through from Step 8."
    },
    "pov_character": { "type": "string", "minLength": 1 },
    "mission": { "type": "string", "minLength": 1 },
    "why_now": { "type": "string", "minLength": 1 },
    "opening_hook": { "type": "string" },
    "conflict": { "type": "string", "minLength": 1 },
    "conflict_type": { "type": "string", "enum": ["internal", "interpersonal", "external", "environmental"] },
    "turning_point": { "type": "string", "minLength": 1 },
    "closing_hook": { "type": "string" },
    "characters_present": { "type": "array", "items": { "type": "string" } },
    "setting": { "type": "string" },
    "sensory_details": { "type": "string" },
    "emotional_trajectory": { "type": "string" },
    "plot_threads_advanced": { "type": "array", "items": { "type": "string" } },
    "promises_planted": { "type": "array", "items": { "type": "string" } },
    "promises_paid": { "type": "array", "items": { "type": "string" } },
    "canon_elements_needed": { "type": "array", "items": { "type": "string" } },
    "target_word_count": { "type": "integer" },
    "notes": { "type": "string" },
    "active_subplots": {
      "type": "array",
      "items": { "type": "string" },
      "description": "subplot_ids active in this scene"
    },
    "hook_actions": {
      "type": "array",
      "items": {
        "type": "object",
        "properties": {
          "hook_id": { "type": "string" },
          "action": { "type": "string", "enum": ["plant", "advance", "resolve", "subvert"] }
        }
      }
    },
    "revelations": {
      "type": "array",
      "items": { "type": "string" },
      "description": "info_ids from revelation schedule revealed in this scene"
    },
    "pov_arc_phase": {
      "type": "string",
      "description": "POV character's current Weiland arc phase"
    },
    "arc_phase_transition": {
      "type": "string",
      "description": "If this scene triggers a phase change, the new phase"
    }
  }
}
