{
  "chapter_number": 19,
  "scene_number": 1,
  "structural_phase": "attack",
  "scene_type": "action",
  "pov_character": "Ben Skywalker",
  "mission": "Help the affected Jedi Knights and prevent Torin from using their suffering as justification for unilateral action.",
  "why_now": "The seal's failure is now affecting active Jedi. The abstract crisis has become a humanitarian one. Torin can weaponize their suffering as justification for his approach.",
  "opening_hook": "",
  "conflict": "Ben vs. consequences of the seal's failure in real time",
  "conflict_type": "external",
  "turning_point": "Kael observes that the affected Knights built their identity on the lattice. Torin's compassion for their suffering becomes justification for his own approach.",
  "closing_hook": "",
  "characters_present": [
    "Ben Skywalker",
    "Desh Rolan",
    "Sera Varik",
    "Torin Hal",
    "Kael Drenn",
    "Outpost Jedi Knights"
  ],
  "setting": "Jedi outpost world near Veranthos",
  "sensory_details": "",
  "emotional_trajectory": "People are hurting. What are you going to do about it?",
  "plot_threads_advanced": [
    "SP2",
    "SP4",
    "SP1"
  ],
  "promises_planted": [
    "H19"
  ],
  "promises_paid": [],
  "canon_elements_needed": [],
  "target_word_count": 3750,
  "notes": "Ben helps but can't fix the underlying problem. Kael observes that the Knights built their identity on the lattice. Torin's compassion weaponized as justification. Renewed urgency and guilt.",
  "active_subplots": [
    "SP2",
    "SP4",
    "SP1"
  ],
  "hook_actions": [
    {
      "hook_id": "H19",
      "action": "plant"
    }
  ],
  "revelations": [],
  "pov_arc_phase": "lie_challenged",
  "arc_phase_transition": ""
}