{
  "chapter_number": 9,
  "scene_number": 1,
  "structural_phase": "response",
  "pov_character": "Ben Skywalker",
  "mission": "Introduce the Ankhural Codex's theoretical framework. Crystallize four philosophical positions.",
  "why_now": "",
  "opening_hook": "",
  "conflict": "Four-way intellectual conflict — Sera (lattice necessary), Torin (lattice artificial), Kael (both projecting), Ben (listening)",
  "conflict_type": "internal",
  "turning_point": "",
  "closing_hook": "",
  "characters_present": [],
  "setting": "Aboard Steady Returns, in transit",
  "sensory_details": "",
  "emotional_trajectory": "",
  "plot_threads_advanced": [],
  "promises_planted": [],
  "promises_paid": [],
  "canon_elements_needed": [],
  "target_word_count": 3750,
  "notes": "Time: Days after thin-place visit\nScene type: sequel\nThematic beat: Four positions, one question, no consensus. Interaction between perspectives is the key.\nOriginal scene_outcome: No consensus — the debate ends without resolution. Shared framework, incompatible interpretations. Ben's willingness to sit with uncertainty established.",
  "active_subplots": [
    "SP1",
    "SP2",
    "SP5"
  ],
  "hook_actions": [
    {
      "hook_id": "H09",
      "action": "plant"
    }
  ],
  "revelations": [
    "R06"
  ],
  "pov_arc_phase": "Response — intellectual framework established"
}