{
  "chapter_number": 15,
  "scene_number": 1,
  "structural_phase": "attack",
  "pov_character": "Ben Skywalker",
  "mission": "Escalate urgency — seal deteriorating faster, institutional dilemma at peak pressure, Torin's arguments become pragmatic",
  "why_now": "",
  "opening_hook": "",
  "conflict": "Ben vs. compounding pressure of a crisis he can't contain",
  "conflict_type": "internal",
  "turning_point": "",
  "closing_hook": "",
  "characters_present": [],
  "setting": "Aboard Steady Returns; communication scenes",
  "sensory_details": "",
  "emotional_trajectory": "",
  "plot_threads_advanced": [],
  "promises_planted": [],
  "promises_paid": [],
  "canon_elements_needed": [],
  "target_word_count": 3750,
  "notes": "Time: Days into direct run toward Veranthos\nThematic beat: Even the person trying to break the pattern falls into it under pressure\nOriginal scene_outcome: Ben withholds full truth from Luke — tactical but ironic. Veraine confirmed heading to Veranthos with complete calibration data. Ruusan's Valley of the Jedi affected. Torin confronts Ben about his own pattern of information curation.",
  "active_subplots": [
    "SP1",
    "SP4",
    "SP5"
  ],
  "hook_actions": [
    {
      "hook_id": "H15",
      "action": "plant"
    }
  ],
  "revelations": [],
  "pov_arc_phase": "Attack — the trap of unilateral action is inescapable",
  "scene_type": "action"
}