{
  "chapter_number": 12,
  "scene_number": 1,
  "structural_phase": "response",
  "pov_character": "Ben Skywalker",
  "mission": "Deliver Maetha's warning. Sera cracks the archive. Veraine's presence confirmed. Torin rationalizes.",
  "why_now": "",
  "opening_hook": "",
  "conflict": "Group vs. implications of the Caldera Knights' fate — interpretive conflict",
  "conflict_type": "internal",
  "turning_point": "",
  "closing_hook": "",
  "characters_present": [],
  "setting": "Lord Maetha's training facility, remote world",
  "sensory_details": "",
  "emotional_trajectory": "",
  "plot_threads_advanced": [],
  "promises_planted": [],
  "promises_paid": [],
  "canon_elements_needed": [],
  "target_word_count": 3750,
  "notes": "Time: Continuing journey\nScene type: action\nThematic beat: Every generation thinks they're smarter than the last. The cycle the story will break.\nOriginal scene_outcome: Maetha's warning delivered. Torin argues 'this time will be different.' Veraine has been here too — alchemical notes missing. The wrongness spikes sharply — seal is being deliberately attacked.",
  "active_subplots": [
    "SP1",
    "SP4",
    "SP5"
  ],
  "hook_actions": [
    {
      "hook_id": "H11",
      "action": "resolve"
    },
    {
      "hook_id": "H12",
      "action": "plant"
    }
  ],
  "revelations": [
    "R05",
    "R07"
  ],
  "pov_arc_phase": "Response — foreshadowing made explicit"
}