{
  "chapter_number": 1,
  "scene_number": 1,
  "structural_phase": "setup",
  "pov_character": "Ben Skywalker",
  "mission": "Establish Ben's character, the mission briefing, and the crew assembly. Plant the thematic premise (individual certainty vs. collective trust) through Ben's internal reluctance to lead a team into the unknown. End with the decision to depart.",
  "why_now": "This is the opening scene — it establishes the status quo before the First Plot Point disrupts it. The crew must assemble before they can depart, and Ben's trust issues must be visible before they're tested.",
  "opening_hook": "Ben receives the mission briefing in Luke's study — a holographic star chart showing the expanding wound regions in the Unknown Regions. The scope of the anomaly is larger than anyone expected.",
  "conflict": "Ben's internal resistance to leading a mixed crew (Jedi, Mandalorian, civilian) into uncharted space where the Force behaves unpredictably. He would prefer to go alone or with trusted Jedi only, but the mission requires diverse expertise.",
  "conflict_type": "internal",
  "turning_point": "Ben accepts the mission and the crew composition, not because he trusts them, but because Luke makes clear that the collective nature of the Force anomaly requires a collective response — a crew of different backgrounds, not a Jedi strike team. Ben's acceptance is reluctant and strategic, not genuine trust.",
  "closing_hook": "As Ben reviews the crew dossiers alone, he lingers on the Jedi scholar's file — something about their eagerness to volunteer for this specific mission nags at him, but he dismisses it as paranoia.",
  "characters_present": ["Ben Skywalker", "TBD — Jedi Scholar"],
  "setting": "Jedi Temple on Coruscant — Luke Skywalker's private study, then a hangar bay during crew assembly",
  "sensory_details": "The blue-white glow of the holographic star chart reflecting off ancient stone walls. The quiet hum of the Temple's atmospheric processors. The smell of old flimsi and caf from Luke's desk. The distant echo of lightsaber practice from training halls below.",
  "emotional_trajectory": "Cautious skepticism -> reluctant acceptance -> lingering unease",
  "plot_threads_advanced": ["mission_briefing", "wound_regions_expanding", "crew_assembly"],
  "promises_planted": ["scholar_eagerness_suspicious", "force_collective_rule_foreshadow", "ben_trust_issues"],
  "promises_paid": [],
  "canon_elements_needed": ["Jedi Temple layout", "Ben Skywalker post-FOTJ characterization", "Luke as Grand Master", "Unknown Regions geography"],
  "target_word_count": 3000,
  "notes": "This is Part 1 (Setup) — no major conflicts should be resolved. The scene should generate empathy for Ben and curiosity about the mission. The scholar should appear warm and trustworthy — no obvious villain signals. Capitalize 'Human', decapitalize 'galaxy' per Star Wars Legends style guide."
}
