{
  "chapter_number": 22,
  "scene_number": 1,
  "structural_phase": "resolution",
  "pov_character": "Ben Skywalker",
  "mission": "Ben and Sera find the lattice resonance solution together through struggle. Plan articulated. Desh's role defined.",
  "why_now": "",
  "opening_hook": "",
  "conflict": "Ben vs. the gap between theory and execution — untested, theoretical, desperate last option",
  "conflict_type": "internal",
  "turning_point": "",
  "closing_hook": "",
  "characters_present": [],
  "setting": "Veranthos surface, group's base position",
  "sensory_details": "",
  "emotional_trajectory": "",
  "plot_threads_advanced": [],
  "promises_planted": [],
  "promises_paid": [],
  "canon_elements_needed": [],
  "target_word_count": 3750,
  "notes": "Time: Hours after Torin's departure\nScene type: sequel\nThematic beat: The solution requires living the theme to execute it\nOriginal scene_outcome: Plan established: three practitioners (Sera, Kael, Ben) working in concert; Desh disrupting Veraine's infrastructure. Sera agrees. Kael is the holdout.",
  "active_subplots": [
    "SP1",
    "SP2",
    "SP4"
  ],
  "hook_actions": [
    {
      "hook_id": "H21",
      "action": "resolve"
    },
    {
      "hook_id": "H22",
      "action": "plant"
    }
  ],
  "revelations": [
    "R12"
  ],
  "pov_arc_phase": "Resolution — the solution is the theme"
}